,show_id,type,title,director,cast,country,date_added,release_year,rating,duration,listed_in,description,durationmovie,durationseason
991,s992,Movie,Kingdom of the Blue Whale,,Tom Selleck,United States,"November 12, 2019",2009,TV-PG,94,"Animals&Nature,Documentary,Family",Marine scientists embark on a mission to uncover the mysteries of the blue whale.,94,0
992,s993,TV Show,Kingdom of the White Wolf,,Jenny Jules,United States,"November 12, 2019",2019,TV-PG,1,"Action-Adventure,Animals&Nature,Docuseries","In the remote, majestic landcape of the high Arctic, a photographer seeks the legendary white wolf.",0,1
993,s994,Movie,Kitbull,Rosana Sullivan,,United States,"November 12, 2019",2019,PG,9,"Animation,Buddy,Comedy",An unlikely connection between a kitten and a pit bull sparks a unique friendship.,0,9
994,s995,Movie,Knick Knack Theatrical Short,John Lasseter,,,"November 12, 2019",2003,G,4,"Animation,Family,Kids",A snowman longs to break out of his snow globe.,0,4
995,s996,Movie,Kronk's New Groove,"Elliot Bour, Saul Blinkoff","Patrick Warburton, Tracey Ullman, Eartha Kitt, David Spade, John Goodman, Wendie Malick",United States,"November 12, 2019",2005,G,78,"Animation,Comedy,ComingofAge",Kronk cooks up a get-rich-quick scheme to impress his Dad.,78,0
996,s997,Movie,La Luna,Enrico Casarosa,"Tony Fucile, Krista Sheffler, Phil Sheridan",United States,"November 12, 2019",2012,G,7,"Animation,ComingofAge,Family",A peculiar story about a young boy coming of age.,0,7
997,s998,TV Show,Lab Rats,,"Billy Unger, Spencer Boldman, Kelli Berglund, Tyrel Williams, Hal Sparks",United States,"November 12, 2019",2011,TV-Y7,4,"Action-Adventure,Comedy,ComingofAge",Leo discovers a secret underground lab with three experiments.,0,4
998,s999,Movie,Lady and the Tramp,Charlie Bean,"Tessa Thompson, Justin Theroux, Sam Elliott, Ashley Jensen, Janelle Monáe, Kiersey Clemons",United States,"November 12, 2019",2019,PG,111,"Action-Adventure,Comedy,Family",A house dog and a stray embark on an adventure and come to understand the value of home.,111,0
999,s1000,Movie,Lava,James Murphy,"Kuana Kahele, Napua Greig",United States,"November 12, 2019",2015,G,9,"Animation,Family,Musical",A love story that takes place over millions of years.,0,9
1000,s1001,TV Show,LEGO Disney Frozen: Northern Lights (Shorts),,,United States,"November 12, 2019",2016,TV-Y7,1,"Action-Adventure,Animation,Comedy",Anna and Elsa search for the missing Northern Lights.,0,1
1001,s1002,TV Show,LEGO Star Wars: All Stars,,"Jasmin Brown, Josh Peck, Zeno Robinson, Max Mittelman, Matthew Wood",United States,"November 12, 2019",2018,TV-Y7,1,"Action-Adventure,Animation,Comedy","Han, Chewie, Leia and more team up for new adventures!",0,1
1002,s1003,TV Show,LEGO Star Wars: All Stars (Shorts),,"Matthew Wood, Yvette Brown, Nicolas Cantu, Carolyn Hennesy, Montse Hernandez, Vanessa Lengies",,"November 12, 2019",2018,TV-Y7,1,"Action-Adventure,Animation,Comedy","Roger, the lovable battle droid, tells his story.",0,1
1003,s1004,TV Show,LEGO Star Wars: Droid Tales,,"Tom Kane, Anthony Daniels, Trevor Devall, Kirby Morrow, Sam Vincent, Michael Donovan",United States,"November 12, 2019",2014,TV-Y7,1,"Action-Adventure,Animation,Comedy",C-3PO recounts the great adventures of the Rebels.,0,1
1004,s1005,TV Show,LEGO Star Wars: Resistance Rises (Shorts),,,"United States, Denmark","November 12, 2019",2015,TV-Y7-FV,1,"Action-Adventure,Animation,Comedy",Follow five untold stories before the Force awakened.,0,1
1005,s1006,TV Show,LEGO Star Wars: The Freemaker Adventures,,"Matt Sloan, Trevor Devall, Greg Baldwin, Michael Daingerfield, Vanessa Lengies, Grey Griffin",United States,"November 12, 2019",2015,TV-Y7,2,"Action-Adventure,Animation,Comedy",12-year old Rowan Freemaker discovers the Kyber Saber.,0,2
1006,s1007,TV Show,LEGO Star Wars: The Freemaker Adventures (Shorts),,,,"November 12, 2019",2016,TV-Y7,1,"Action-Adventure,Animation,Comedy",The Freemakers lend a helping hand to the rebel fleet.,0,1
1007,s1008,Movie,LEGO Star Wars: The New Yoda Chronicles - Clash of the Skywalkers,Michael Hegner,"Tom Kane, Anthony Daniels, Matt Sloan, Trevor Devall, Kirby Morrow, Sam Vincent",United States,"November 12, 2019",2014,TV-Y7,24,"Action-Adventure,Animation,Comedy",The enraged Emperor sends Darth Vader to destroy Luke.,0,24
1008,s1009,Movie,LEGO Star Wars: The New Yoda Chronicles - Raid on Coruscant,Michael Hegner,"Tom Kane, Anthony Daniels, Matt Sloan, Trevor Devall, Kirby Morrow, Sam Vincent","Denmark, China","November 12, 2019",2014,TV-Y7,24,"Action-Adventure,Animation,Comedy",Luke Skywalker attempts a daring raid on Coruscant.,0,24
1009,s1010,Movie,LEGO Star Wars: The New Yoda Chronicles – Duel of the Skywalkers,Michael Hegner,"Tom Kane, Anthony Daniels, Matt Sloan, Trevor Devall, Kirby Morrow, Sam Vincent",United States,"November 12, 2019",2014,TV-Y7,24,"Action-Adventure,Animation,Comedy",Luke Skywalker accidently opens a remaining holocron.,0,24
1010,s1011,Movie,LEGO Star Wars: The New Yoda Chronicles – Escape from the Jedi Temple,Michael Hegner,"Tom Kane, Anthony Daniels, Matt Sloan, Trevor Devall, Sam Vincent, Kelly Metzger",United States,"November 12, 2019",2014,TV-Y7,24,"Action-Adventure,Animation,Comedy",Yoda and Obi-Wan recall freeing the Holocrons from the Temple.,0,24
1011,s1012,Movie,LEGO Star Wars: The New Yoda Chronicles – Race for the Holocrons,Michael Hegner,"Tom Kane, Anthony Daniels, Matt Sloan, Trevor Devall, Brian Drummond, Michael Donovan",United States,"November 12, 2019",2014,TV-Y7,24,"Action-Adventure,Animation,Comedy",Obi-Wan urges Luke to travel to Tatooine.,0,24
1012,s1013,Movie,Lemonade Mouth,Patricia Riggen,"Bridgit Mendler, Adam Hicks, Hayley Kiyoko, Naomi Scott, Blake Michael, Nick Roux",United States,"November 12, 2019",2011,TV-G,110,"ComingofAge,Drama,Music",A ragtag group of freshmen come together in the name of rock 'n' roll.,110,0
1013,s1014,Movie,Lend a Paw,Clyde Geronimi,,United States,"November 12, 2019",1941,TV-Y7,8,"Animation,Family,Kids",Pluto's jealousy of a kitten leaves him conflicted about rescuing it. See details for advisory.,0,8
1014,s1015,Movie,Leroy & Stitch,"Roberts Gannaway, Tony Craig","Daveigh Chase, Chris Sanders, David Stiers, Kevin McDonald, Tia Carrere, Kevin Michael Richardson",United States,"November 12, 2019",2006,G,76,"Action-Adventure,Animation,Comedy","Dr. Hamsterviel forces Jumba to create Leroy, the evil twin of Stitch.",76,0
1015,s1016,Movie,Let it Shine,Paul Hoen,"Tyler Williams, Coco Jones, Trevor Jackson, Brandon Smith, Dawnn Lewis, Alex Désert",United States,"November 12, 2019",2012,TV-G,103,"ComingofAge,Drama,Music",A true poet overcomes self-doubt and shows everyone his artistic genius.,103,0
1016,s1017,Movie,Life is Ruff,Charles Haid,"Kyle Massey, Kay Panabaker, Mitchel Musso, Carter Jenkins, Mark Lawrence, Judith Moreland",United States,"November 12, 2019",2005,TV-G,85,"Animals&Nature,Comedy,ComingofAge",A teenager enters an adopted mutt into a dog show to try to win $5000.,85,0
1017,s1018,Movie,Life With Mikey,James Lapine,"Michael Fox, Nathan Lane, Cyndi Lauper, David Krumholtz, David Huddleston, Christina Vidal",United States,"November 12, 2019",1993,PG,92,"Buddy,Comedy,ComingofAge",An ex-child star struggling as an agent discovers a sassy new client.,92,0
1018,s1019,Movie,Life-Size 2,Steven Tsuchida,"Tyra Banks, Francia Raisa, Gavin Stenhouse, Hank Chen, Alison Fernandez, Shanica Knowles",United States,"November 12, 2019",2018,TV-14,82,"Comedy,ComingofAge,Fantasy",Eve magically awakes to help get Grace back on track.,82,0
1019,s1020,Movie,Lifted,Gary Rydstrom,,United States,"November 12, 2019",2006,G,5,"Animation,Comedy,Family",A young alien bungles his first lesson in abduction.,0,5
1020,s1021,Movie,Lilo & Stitch,"Christopher Sanders, Dean DeBlois","Daveigh Chase, Christopher Sanders, Tia Carrere, David Ogden Stiers, Kevin McDonald, Ving Rhames",United States,"November 12, 2019",2002,TV-PG,86,"Action-Adventure,Animation,Family",A little girl adopts a wanted alien wreaking havoc on the Hawaiian Islands.,86,0
1021,s1022,Movie,Lilo & Stitch 2: Stitch Has a Glitch,"Tony Leondis, Michael LaBash","Christopher Sanders, Dakota Fanning, Tia Carrere, David Stiers, Kevin McDonald, Kunewa Mook",United States,"November 12, 2019",2005,PG,70,"Animation,Comedy,Dance",A glitch sends Stich out of control just before Lilo's big hula contest.,70,0
1022,s1023,TV Show,Lizzie McGuire,,"Hilary Duff, Lalaine , Adam Lamberg, Jake Thomas, Hallie Todd, Robert Carradine",United States,"November 12, 2019",2000,TV-G,2,"Comedy,ComingofAge,Kids","Lizzie McGuire has great friends, a great family and even great foes. Get inside her head.",0,2
1023,s1024,Movie,Lonesome Ghosts,Burt Gillett,,United States,"November 12, 2019",1937,TV-Y7,9,"Animation,Family,Kids","Mickey Mouse, Donald Duck and Goofy run a ghost exterminating agency. See details for advisory.",0,9
1024,s1025,TV Show,Lost Treasures of the Maya,,Albert Lin,"United States, Guatemala","November 12, 2019",2018,TV-PG,1,"Docuseries,Historical",A high-tech treasure map rewrites the history of the ancient Maya in the Guatemalan jungle.,0,1
1025,s1026,Movie,Lou,Dave Mullins,,United States,"November 12, 2019",2017,G,7,"Action-Adventure,Animation,Comedy",A toy-stealing bully meets his match in a Lost & Found box.,0,7
1026,s1027,Movie,Luck of the Irish,Paul Hoen,"Paul Kiernan, Timothy Omundson, Ryan Merriman, Glenndon Chatman, Henry Gibson, Marita Geraghty",United States,"November 12, 2019",2001,TV-G,86,"Comedy,ComingofAge,Fantasy","When his lucky charm is stolen, Kyle learns that he is part leprechaun.",86,0
1027,s1028,Movie,Luxo Jr.,,,United States,"November 12, 2019",1986,G,2,"Animation,Comedy,Family",A baby lamp finds a ball to play with.,0,2
1028,s1029,Movie,Magician Mickey,David Hand,"Pinto Colvig, Walt Disney, Clarence Nash",United States,"November 12, 2019",1937,TV-PG,8,"Animation,Comedy,Family",Donald continually heckles Mickey's magic act. See details for advisory.,0,8
1029,s1030,Movie,Mail Dog,Charles Nichols,,United States,"November 12, 2019",1947,TV-G,7,"Animation,Comedy,Family",Pluto must deliver mail to a remote outpost. See details for advisory.,0,7
1030,s1031,Movie,Man Among Cheetahs,,Bob Poole,United States,"November 12, 2019",2017,TV-PG,44,"Animals&Nature,Documentary,Family",A wildlife filmmaker tries to keep up with a cheetah mom determined to keep her cubs alive.,44,0
1031,s1032,Movie,Mars: Inside SpaceX,Julia Reagan,,United States,"November 12, 2019",2018,TV-PG,47,Documentary,Go behind the scenes as Elon Musk and his engineers prepare for the Falcon Heavy rocket launch.,47,0
1032,s1033,TV Show,Marvel Comics X-Men,,"Cedric Smith, Catherine Disher, Alyson Court, Chris Potter, George Buza, Iona Morris","United States, Canada","November 12, 2019",1992,TV-Y7,5,"Action-Adventure,Animation,Fantasy",In the Marvel Comics universe mutants are persecuted by a hateful and fearful populous.,0,5
1033,s1034,TV Show,Marvel Rising: Initiation (Shorts),,,United States,"November 12, 2019",2017,TV-Y7,1,"Action-Adventure,Animation,Kids",Ghost-Spider is falsely accused of her friend's death.,0,1
1034,s1035,Movie,Marvel Rising: Secret Warriors,Alfred Gimeno,"Dee Baker, Chloe Bennet, Kathreen Khavari, Andrew Kishino, Meera Kumbhani, Kamil McFadden",United States,"November 12, 2019",2018,TV-Y7-FV,80,"Action-Adventure,Animation,ComingofAge",Marvel’s young powered heroes join forces to protect the Universe.,80,0
1035,s1036,Movie,Marvel Studios: Assembling A Universe,,"Jeff McNeil, Meghan Leon, Jason Hillhouse, Robert Downey Jr., Clark Gregg, Jon Favreau",United States,"November 12, 2019",2014,TV-PG,43,"Action-Adventure,Documentary,Superhero",An exclusive look inside the world of Marvel Studios.,43,0
1036,s1037,Movie,Marvel Studios: Expanding the Universe,,,,"November 12, 2019",2019,TV-PG,13,"Documentary,Family",An exciting look into the future of Marvel Studios’ films and upcoming Disney+ series.,0,13
1037,s1038,Movie,Marvel Studios' Ant-Man,Peyton Reed,"Paul Rudd, Evangeline Lilly, Corey Stoll, Bobby Cannavale, Michael Peña, Tip Harris",United States,"November 12, 2019",2015,PG-13,119,"Action-Adventure,Comedy,ScienceFiction",Scott Lang and Dr. Hank Pym plan a heist that could save the world.,119,0
1038,s1039,Movie,Marvel Studios' Avengers: Age of Ultron,Joss Whedon,"Robert Downey Jr., Chris Hemsworth, Mark Ruffalo, Chris Evans, Scarlett Johansson, Jeremy Renner",United States,"November 12, 2019",2015,PG-13,143,"Action-Adventure,ScienceFiction,Superhero",Tony Stark unwittingly creates an A.I. monster bent on destroying mankind.,143,0
1039,s1040,Movie,Marvel Studios' Avengers: Endgame,"Anthony Russo, Joe Russo","Robert Downey Jr., Chris Evans, Mark Ruffalo, Chris Hemsworth, Scarlett Johansson, Jeremy Renner",United States,"November 12, 2019",2019,PG-13,183,"Action-Adventure,Fantasy,ScienceFiction","The epic finale to the Infinity Saga, this dramatic showdown pits the Avengers against Thanos.",183,0
1040,s1041,Movie,Marvel Studios' Captain America: Civil War,"Anthony Russo, Joe Russo","Chris Evans, Robert Downey Jr., Scarlett Johansson, Sebastian Stan, Anthony Mackie, Don Cheadle",United States,"November 12, 2019",2016,PG-13,150,"Action-Adventure,ScienceFiction,Superhero","Captain America and Iron Man clash, causing the Avengers to choose sides.",150,0
1041,s1042,Movie,Marvel Studios' Captain America: The First Avenger,Joe Johnston,"Chris Evans, Tommy Jones, Hugo Weaving, Hayley Atwell, Sebastian Stan, Dominic Cooper",United States,"November 12, 2019",2011,PG-13,126,"Action-Adventure,ScienceFiction,Superhero",A top-secret research project turns Steve Rogers into Captain America.,126,0
1042,s1043,Movie,Marvel Studios' Captain America: The Winter Soldier,"Anthony Russo, Joe Russo","Chris Evans, Scarlett Johansson, Sebastian Stan, Anthony Mackie, Cobie Smulders, Frank Grillo",United States,"November 12, 2019",2014,PG-13,138,"Action-Adventure,ScienceFiction,Superhero",Captain America and Black Widow join forces against the Winter Soldier.,138,0
1043,s1044,Movie,Marvel Studios' Captain Marvel,"Anna Boden, Ryan Fleck","Brie Larson, Samuel Jackson, Ben Mendelsohn, Djimon Hounsou, Lee Pace, Lashana Lynch","United States, Australia","November 12, 2019",2019,PG-13,126,"Action-Adventure,ScienceFiction,Superhero",Marvel Studios’ Captain Marvel launches the MCU’s most powerful hero.,126,0
1044,s1045,Movie,Marvel Studios' Doctor Strange,Scott Derrickson,"Benedict Cumberbatch, Chiwetel Ejiofor, Rachel McAdams, Benedict Wong, Michael Stuhlbarg, Benjamin Bratt",United States,"November 12, 2019",2016,PG-13,116,"Action-Adventure,Fantasy,Superhero",A famous surgeon battles unseen forces bent on destroying our reality.,116,0
1045,s1046,Movie,Marvel Studios' Guardians of the Galaxy,James Gunn,"Chris Pratt, Zoë Saldana, Dave Bautista, Vin Diesel, Bradley Cooper, Lee Pace",United States,"November 12, 2019",2014,PG-13,122,"Action-Adventure,Comedy,ScienceFiction",A group of misfit heroes become the object of an unrelenting bounty hunt.,122,0
1046,s1047,Movie,Marvel Studios' Guardians of the Galaxy Vol. 2,James Gunn,"Chris Pratt, Bradley Cooper, Vin Diesel, Pom Klementieff, Zoë Saldana, Dave Bautista",United States,"November 12, 2019",2017,PG-13,137,"Action-Adventure,Comedy,ScienceFiction",The Guardians fight to keep their newfound family together as they discover Quill's parentage.,137,0
1047,s1048,Movie,Marvel Studios' Iron Man,Jon Favreau,"Robert Downey Jr., Terrence Howard, Jeff Bridges, Gwyneth Paltrow, Leslie Bibb, Shaun Toub","United States, Canada","November 12, 2019",2008,PG-13,127,"Action-Adventure,ScienceFiction,Superhero",Jet-setting industrialist Tony Stark vows to protect the world as Iron Man.,127,0
1048,s1049,Movie,Marvel Studios' Iron Man 2,Jon Favreau,"Robert Downey Jr., Gwyneth Paltrow, Don Cheadle, Scarlett Johansson, Sam Rockwell, Clark Gregg",United States,"November 12, 2019",2010,PG-13,125,"Action-Adventure,ScienceFiction,Superhero",Inventor Tony Stark forges new alliances to confront powerful enemies.,125,0
1049,s1050,Movie,Marvel Studios' Iron Man 3,Shane Black,"Robert Downey Jr., Gwyneth Paltrow, Don Cheadle, Guy Pearce, Rebecca Hall, Stephanie Szostak",United States,"November 12, 2019",2013,PG-13,132,"Action-Adventure,ScienceFiction,Superhero","His personal world destroyed, Tony Stark embarks on a harrowing quest to find those responsible.",132,0
1050,s1051,Movie,Marvel Studios' The Avengers,Joss Whedon,"Robert Downey Jr., Chris Evans, Mark Ruffalo, Chris Hemsworth, Scarlett Johansson, Jeremy Renner",United States,"November 12, 2019",2012,PG-13,145,"Action-Adventure,Fantasy,ScienceFiction",Nick Fury recruits a team of heroes to battle an unexpected enemy.,145,0
1051,s1052,Movie,Marvel Studios' Thor,Kenneth Branagh,"Chris Hemsworth, Natalie Portman, Tom Hiddleston, Anthony Hopkins, Stellan Skarsgård, Kat Dennings",United States,"November 12, 2019",2011,PG-13,116,"Action-Adventure,Fantasy,Superhero","Thor, Asgard's greatest hero, reignites an ancient war that he must take part in from Earth.",116,0
1052,s1053,Movie,Marvel Studios' Thor: The Dark World,Alan Taylor,"Chris Hemsworth, Natalie Portman, Tom Hiddleston, Anthony Hopkins, Rene Russo, Stellan Skarsgård",United States,"November 12, 2019",2013,PG-13,114,"Action-Adventure,Fantasy,ScienceFiction",Thor must set out on his most dangerous and personal journey yet.,114,0
1053,s1054,TV Show,Marvel Ultimate Spider-Man,,"Drake Bell, Chi McBride, Steven Weber, J.K. Simmons, Tom Kenny, Clark Gregg",United States,"November 12, 2019",2011,TV-Y7,4,"Action-Adventure,Animation,Fantasy",Spider-Man trains alongside four fellow teenage superheroes.,0,4
1054,s1055,TV Show,Marvel's Agent Carter,,"Hayley Atwell, James D'Arcy, Chad Murray, Enver Gjokaj, Shea Whigham",United States,"November 12, 2019",2014,TV-14,2,"Action-Adventure,ScienceFiction,Spy/Espionage","Working for SSR, Peggy would rather be in the field.",0,2
1055,s1056,TV Show,Marvel's Ant-Man (Shorts),,,United States,"November 12, 2019",2016,TV-Y7,1,"Action-Adventure,Animation,Comedy",Ant-Man protects the world one inch at a time!,0,1
1056,s1057,TV Show,Marvel's Avengers Assemble,,"Adrian Pasdar, Fred Tatasciore, Roger Smith, Travis Willingham, Troy Baker, Bumper Robinson",United States,"November 12, 2019",2012,TV-Y7,5,"Action-Adventure,Animation,Kids",Marvel’s mightiest heroes combine their power.,0,5
1057,s1058,TV Show,Marvel's Avengers: Secret Wars (Shorts),,,,"November 12, 2019",2016,TV-Y7,1,"Action-Adventure,Animation,Kids",A new team of heroes joins the Avengers.,0,1
1058,s1059,TV Show,Marvel's Guardians of the Galaxy (Series),,"Will Friedle, Trevor Devall, Kevin Richardson, Vanessa Marshall, David Sobolov",United States,"November 12, 2019",2015,TV-Y7,3,"Action-Adventure,Animation,Kids",The Guardians find a map leading to a powerful weapon.,0,3
1059,s1060,TV Show,Marvel's Guardians of the Galaxy (Shorts),,,,"November 12, 2019",2014,TV-Y7,2,"Action-Adventure,Animation,Kids",The stories of five outlaws who became the Guardians.,0,2
1060,s1061,TV Show,Marvel's Hero Project,,,United States,"November 12, 2019",2019,TV-PG,1,"Docuseries,Family","Celebrate the inspiring efforts of young, real life heroes as they join Marvel’s Hero Project.",0,1
1061,s1062,TV Show,Marvel's Inhumans,,"Anson Mount, Serinda Swan, Ken Leung, Eme Ikwuakor, Isabelle Cornish, Ellen Woglom",United States,"November 12, 2019",2017,TV-14,1,"Action-Adventure,ScienceFiction,Superhero",The never-before-told adventure of the Royal Family.,0,1
1062,s1063,TV Show,Marvel's Rocket & Groot (Shorts),,,,"November 12, 2019",2016,TV-Y7,1,"Action-Adventure,Animation,Buddy",Rocket and Groot shop for a new ship.,0,1
1063,s1064,TV Show,Marvel's Ultimate Comics,,"Cole Howard, Brian Drummond",,"November 12, 2019",2016,TV-Y7,1,"Action-Adventure,Animation,Comedy",Spidey and Iron Man team-up. Black Panther vs. Ghost.,0,1
1064,s1065,Movie,Mary Poppins,Robert Stevenson,"Julie Andrews, Dick Van Dyke, David Tomlinson, Glynis Johns, Hermione Baddeley, Karen Dotrice",United States,"November 12, 2019",1964,G,142,"Family,Fantasy,Musical",A magical nanny reconnects a father and mother with their two children.,142,0
1065,s1066,Movie,Mater and the Ghostlight,John Lasseter,"Larry the Cable Guy , Owen Wilson, Michael Wallis, Bonnie Hunt, Paul Newman, Cheech Marin",United States,"November 12, 2019",2006,TV-Y7,8,"Animation,Comedy,Family",Mater ponders if the legend of the Ghostlight is true.,0,8
1066,s1067,Movie,Meet the Deedles,Steve Boyum,"Paul Walker, Steve Wormer, John Ashton, A.J. Langer, Robert Englund, Megan Cavanagh",United States,"November 12, 2019",1998,PG,94,"Buddy,Comedy",Two surfer dudes try to stop an ex-park ranger from stealing Old Faithful.,94,0
1067,s1068,Movie,Meet the Robinsons,Stephen Anderson,"Angela Bassett, Daniel Hansen, Jordan Fry, Matthew Josten, John Ford, Dara McGarry",United States,"November 12, 2019",2007,G,97,"Action-Adventure,Animation,Family",A young inventor uses time travel to find the family he never knew.,97,0
1068,s1069,Movie,Melody Time,"Clyde Geronimi, Jack Kinney, Hamilton Luske","Roy Rogers, Trigger , Dennis Day, The Andrews Sisters , Fred Waring and His Pennsylvanians , Freddy Martin",United States,"November 12, 2019",1948,TV-PG,76,"Animation,Anthology,Family",Classic stories blend high-spirited music and unforgettable characters. See details for advisory.,76,0
1069,s1070,Movie,Mickey Down Under,Charles Nichols,,United States,"November 12, 2019",1948,TV-G,7,"Animation,Comedy,Family",Mickey and Pluto vacation in Australia. See details for advisory.,0,7
1070,s1071,TV Show,Mickey Mouse (Shorts),,,United States,"November 12, 2019",2012,TV-G,5,"Animation,Kids","All-new series of cartoon shorts, Mickey Mouse finds himself in silly situations around the world!",0,5
1071,s1072,TV Show,Mickey Mouse Club (1955-59),,,United States,"November 12, 2019",1955,TV-PG,1,"Family,Variety",The Mickey Mouse Club is a variety show featuring the Mouseketeers. See details for advisory.,0,1
1072,s1073,Movie,"Mickey, Donald, Goofy: The Three Musketeers",Donovan Cook,"Wayne Allwine, Tony Anselmo, Bill Farmer, Russi Taylor, Tress MacNeille, Jim Cummings",United States,"November 12, 2019",2004,G,71,"Action-Adventure,Animation,Family",An animated version of the classic tale starring three Disney favorites.,71,0
1073,s1074,Movie,Mickey's Birthday Party,Riley Thomson,"Walt Disney, Thelma Boardman, Pinto Colvig, Clarence Nash, Florence Gill",United States,"November 12, 2019",1942,TV-G,9,"Animation,Comedy,Family",The gang gives Mickey a surprise birthday party. See details for advisory.,0,9
1074,s1075,Movie,Mickey's Christmas Carol,Burny Mattinson,"Alan Young, Wayne Allwine, Hal Smith, Will Ryan, Eddy Carroll, Patricia Parris",United States,"November 12, 2019",1983,G,26,"Animation,Comedy,Family",All your Disney pals star in this retelling of a Dickens Christmas classic.,0,26
1075,s1076,Movie,Mickey's Delayed Date,Charles Nichols,,United States,"November 12, 2019",1947,TV-G,7,"Animation,Comedy,Family",Pluto helps Mickey get ready when he forgets about his big date. See details for advisory.,0,7
1076,s1077,Movie,Mickey's Once Upon a Christmas,"Bradley Raymond, Jun Falkenstein, Bill Speers","Kelsey Grammer, Wayne Allwine, Russi Taylor, Tony Anselmo, Diane Michelle, Tress MacNeille",United States,"November 12, 2019",1999,TV-G,67,"Animation,Anthology,Comedy",Join Mickey and his pals for tales of their most memorable Christmases.,67,0
1077,s1078,Movie,Mickey's Rival,"Wilfred Jackson, Walt Disney","Walt Disney, Marcelite Garner, Sonny Dawson",United States,"November 12, 2019",1936,TV-G,9,"Animation,Comedy,Family","Mickey's rival, Mortimer, strives for Minnie's affections. See details for advisory.",0,9
1078,s1079,Movie,Mickey's Trailer,Ben Sharpsteen,"Clarence Nash, Pinto Colvig, Walt Disney",United States,"November 12, 2019",1938,TV-PG,8,"Animation,Comedy,Family","Mickey, Donald and Goofy are on an adventurous car trip. See details for advisory.",0,8
1079,s1080,Movie,Mickey's Twice Upon a Christmas,Matthew O'Callaghan,"Wayne Allwine, Tony Anselmo, Jeff Bennett, Jim Cummings, Bill Farmer, Tress MacNeille",United States,"November 12, 2019",2004,G,70,"Animation,Anthology,Comedy",Mickey and his pals learn the true meaning of Christmas…with Santa's help.,70,0
1080,s1081,Movie,Mighty Joe Young,Ron Underwood,"Bill Paxton, Charlize Theron, Rade Šerbedžija, Regina King, Peter Firth, Naveen Andrews",United States,"November 12, 2019",1998,PG,116,"Action-Adventure,Animals&Nature,Family","Taken to Hollywood to hide, a mighty gorilla is chased by a hunter.",116,0
1081,s1082,Movie,Mike's New Car,"Pete Docter, Roger Gould","Billy Crystal, John Goodman",United States,"November 12, 2019",2002,TV-G,5,"Animation,Buddy,Comedy",Mike and Sulley try to take Mike's new car for a ride.,0,5
1082,s1083,Movie,Minutemen,Lev Spiro,"Jason Dolley, Luke Benward, Nicholas Braun, Chelsea Staub, Steven McQueen, Kara Crane",United States,"November 12, 2019",2008,TV-G,91,"Action-Adventure,Comedy,ScienceFiction",Three teen outcasts invent a time machine to save their social lives.,91,0
1083,s1084,Movie,Miracle,Gavin O'Connor,"Kurt Russell, Patricia Clarkson, Noah Emmerich, Sean McCann, Kenneth Welsh, Eddie Cahill","Canada, United States","November 12, 2019",2004,PG,137,"Drama,Historical,Sports",The story of the 1980 U.S. Olympic hockey team's win over a seemingly invincible Soviet squad.,137,0
1084,s1085,Movie,Miracle at Midnight,Ken Cameron,"Sam Waterston, Mia Farrow, Justin Whalin, Patrick Malahide, Benedick Blythe",United States,"November 12, 2019",1998,TV-14,89,"Drama,Historical",A family risks their lives to help their neighbors escape the Nazis.,89,0
1085,s1086,Movie,Miracle in Lane 2,Greg Beeman,"Frankie Muniz, Rick Rossovich, Molly Hagan, Patrick Levis, Roger Brown, Tuc Watkins",United States,"November 12, 2019",2000,TV-G,90,"Biographical,Drama,Sports",A physically challenged boy strives to compete in a national soapbox derby.,90,0
