,show_id,type,title,director,cast,country,date_added,release_year,rating,duration,listed_in,description,durationmovie,durationseason
401,s402,Movie,Secret Society of Second-Born Royals,,"Peyton Lee, Niles Fitch, Isabella Blake-Thomas, Olivia Deeble, Skylar Astin, Elodie Yung",United States,"September 25, 2020",2020,TV-PG,99,"Action-Adventure,ComingofAge,Family","Sam, a rebellious royal, learns she is part of the Secret Society of Second-Born Royals.",99,0
402,s403,Movie,The Giant Robber Crab,Moritz Katz,Colin Solman,United States,"September 25, 2020",2019,TV-PG,44,"Animals&Nature,Documentary","As we follow the robber’s life cycle, we learn that crabs are much more than creepy crawlies.",44,0
403,s404,TV Show,Wild Central America,,Nigel Marven,,"September 25, 2020",2020,TV-PG,1,"Action-Adventure,Animals&Nature,Docuseries",Presenter Nigel Marven discovers the colourful and varied wildlife and culture of Central America.,0,1
404,s405,TV Show,Ancient China from Above,,Dr. Allan Maca,United States,"September 18, 2020",2020,TV-14,1,"Docuseries,Historical",Archaeologist Allan Maca reveals the amazing wonders of Ancient China like never before.,0,1
405,s406,TV Show,Becoming,,,United States,"September 18, 2020",2020,TV-PG,1,"Anthology,Docuseries,Family","Becoming chronicles the origin stories of world-class entertainers, musicians and athletes.",0,1
406,s407,TV Show,Coop & Cami Ask The World,,"Ruby Turner, Dakota Lotus, Olivia Sanabia, Albert Tsai, Paxton Booth, Rebecca Metz",United States,"September 18, 2020",2018,TV-G,2,"Comedy,Family,Kids","Cooper and Cami Wrather co-host ""Would You Wrather.""",0,2
407,s408,TV Show,Europe from Above,,Julian Barratt,United Kingdom,"September 18, 2020",2019,TV-G,1,"Docuseries,Reality",Europe from Above takes to the air over Europe’s finest cultural and geographical landmarks.,0,1
408,s409,Movie,Ever After: A Cinderella Story,Andy Tennant,"Drew Barrymore, Anjelica Huston, Dougray Scott, Patrick Godfrey, Megan Dodds, Melanie Lynskey",United States,"September 18, 2020",1998,PG-13,122,"Drama,Romance",A young woman falls in love with a prince while pretending to be a princess.,122,0
409,s410,TV Show,Kingdom of the Mummies,,Kerry Shale,United States,"September 18, 2020",2020,TV-14,1,"Docuseries,Historical,Reality",A team of archaeologists uncover the first Egyptian funeral parlor ever found.,0,1
410,s411,Movie,Morning Light,Mark Monroe,Patrick Warburton,United States,"September 18, 2020",2008,PG,99,"Documentary,Sports","Fifteen rookie sailors race to be part of the ""Morning Light"" crew.",99,0
411,s412,Movie,Notre Dame: Race Against The Inferno,"Fabrice Gardel, Simon Kessler, Josselin Mahot",Paul Bandey,"United Kingdom, France","September 18, 2020",2019,TV-PG,45,Documentary,"On April 15, 2019, Paris’ firefighters gave everything to save the Notre Dame cathedral.",45,0
412,s413,TV Show,Once Upon a Time,,"Ginnifer Goodwin, Jennifer Morrison, Robert Carlyle, Lana Parrilla, Jared Gilmore, Josh Dallas",United States,"September 18, 2020",2011,TV-PG,7,"Action-Adventure,Fantasy,SoapOpera/Melodrama",Fairy tale characters inhabit a land of good and evil.,0,7
413,s414,TV Show,Soy Luna,,"Karol Sevilla, Ruggero Pasquarelli, Valentina Zenere, Lucila Gandolfo, Michael Ronda, Carolina Kopelioff","Argentina, Mexico","September 18, 2020",2015,TV-G,3,"Comedy,ComingofAge,Drama",Luna will learn that love transcends distance.,0,3
414,s415,TV Show,Violetta,,"Diego Ramos, Martina Stoessel, Pablo Espinosa, Jorge Blanco, Mercedes Lambre, Nicolás Garnier",Argentina,"September 18, 2020",2011,TV-G,3,"ComingofAge,Drama,Music",Violetta is a talented teen following her dream.,0,3
415,s416,Movie,Christopher Robin,Marc Forster,"Ewan McGregor, Hayley Atwell, Bronte Carmichael, Mark Gatiss, Oliver Davies, Ronke Adekoluejo","United Kingdom, United States","September 11, 2020",2018,PG,109,"Drama,Family,Fantasy",Pooh leaves the Hundred Acre Wood to help grown-up Christopher Robin.,109,0
416,s417,Movie,D2: The Mighty Ducks,Sam Weisman,"Emilio Estevez, Michael Tucker, Jan Rubeš, Kathryn Erbe, Joshua Jackson, Elden Ratliff",United States,"September 4, 2020",1994,PG,107,"Comedy,Drama,Family",The Mighty Ducks face the meanest team on ice at the Junior Goodwill Games.,107,0
417,s418,Movie,D3: The Mighty Ducks,Robert Lieberman,"Emilio Estevez, Jeffrey Nordling, David Selby, Heidi Kling, Joshua Jackson, Elden Ratliff",United States,"September 4, 2020",1996,PG,104,"Comedy,ComingofAge,Drama",The Mighty Ducks inherit a new coach and a new set of problems.,104,0
418,s419,TV Show,Earth to Ned,,,United States,"September 4, 2020",2020,TV-PG,1,"Comedy,Parody,ScienceFiction","From the Jim Henson Company, alien commander Ned hosts a late-night talk show with celebrity guests.",0,1
419,s420,Movie,Trick or Treat,Jack Hannah,,United States,"September 4, 2020",1952,TV-G,9,"Animation,Family,Fantasy","Donald plays a trick on his nephews, but a witch helps them out. See details for advisory.",0,9
420,s421,Movie,Alice Through the Looking Glass,James Bobin,"Johnny Depp, Anne Hathaway, Mia Wasikowska, Matt Lucas, Rhys Ifans, Helena Carter","United States, United Kingdom","August 28, 2020",2016,PG,115,"Action-Adventure,Fantasy",Alice returns to Underland to save the Mad Hatter in a race against time.,115,0
421,s422,Movie,Phineas and Ferb The Movie: Candace Against the Universe,,"Ashley Tisdale, Vincent Martella, Ali Wong, Dan Povenmire, Alyson Stoner, Maulik Pancholy",United States,"August 28, 2020",2020,TV-G,86,"Action-Adventure,Animation,Comedy","Phineas and Ferb set out across the galaxy to rescue Candace, who has been abducted by aliens.",86,0
422,s423,Movie,Back to the Titanic,,,United Kingdom,"August 21, 2020",2020,TV-PG,44,"Documentary,Historical",Back to the Titanic documents the first manned dives to Titanic in nearly 15 years.,44,0
423,s424,Movie,Beauty and the Beast,Bill Condon,"Emma Watson, Dan Stevens, Luke Evans, Kevin Kline, Josh Gad, Ewan McGregor",United States,"August 21, 2020",2017,PG,138,"Family,Fantasy,Musical",Belle must look beyond the Beast’s exterior to find the true Prince within.,138,0
424,s425,Movie,Mars: One Day on the Red Planet,Martin Johnson,Nigel Barber,United States,"August 21, 2020",2020,TV-PG,88,Documentary,"An epic journey around the real Mars – built from data, as you’ve never seen it before.",88,0
425,s426,Movie,The One and Only Ivan,Thea Sharrock,"Sam Rockwell, Angelina Jolie, Danny DeVito, Helen Mirren, Brooklynn Prince, Ramón Rodríguez",United States,"August 21, 2020",2020,PG,95,"Drama,Family,Fantasy",An adaptation of the award-winning book about a very special gorilla.,95,0
426,s427,TV Show,"Weirdest, Bestest, Truest",,"Charlie Engelman, Kirby Engelman",,"August 21, 2020",2018,TV-G,1,"Animals&Nature,Kids,Variety",Siblings Kirby and Charlie share strange discoveries and fun facts from the world of Weird But True!,0,1
427,s428,TV Show,Disney Junior T.O.T.S.: Calling All T.O.T.S. (Shorts),,"Jet Jurgensmeyer, Christian Simon, Megan Hilty",,"August 14, 2020",2020,TV-Y,1,"Animation,Kids,Music",What happens after the baby animals are delivered?,0,1
428,s429,Movie,Disney Zombies 2,Paul Hoen,"Milo Manheim, Meg Donnelly, Trevor Tordjman, Kylee Russell, Carla Jeffery, Chandler Kinney",United States,"August 14, 2020",2020,TV-G,84,"ComingofAge,Fantasy,Musical",Zed and Addison encounter a group of werewolves!,84,0
429,s430,Movie,India's Wild Leopards,,"Sandesh Kadur, Priya Singh",India,"August 14, 2020",2020,TV-14,45,"Animals&Nature,Documentary",Cameraman Sandesh Kadur’s mission is to uncover the secretive lives of India’s leopards.,45,0
430,s431,TV Show,Jungle Animal Rescue,,Dan Nachtrab,United States,"August 14, 2020",2019,TV-PG,1,"Animals&Nature,Docuseries,Family",A team of conservationists and veterinarians helps India’s people and wildlife coexist.,0,1
431,s432,Movie,Magic Camp,Mark Waters,"Adam DeVine, Gillian Jacobs, Nathaniel McIntyre, Jeffrey Tambor, Cole Sand, Isabella Crovetti",United States,"August 14, 2020",2020,PG,101,"Comedy,Family",A group of misfit campers help a down-on-his-luck magician rediscover his love of magic.,101,0
432,s433,Movie,Marvel Studios' Ant-Man and the Wasp,Peyton Reed,"Paul Rudd, Evangeline Lilly, Michael Peña, Walton Goggins, Hannah John-Kamen, David Dastmalchian",United States,"August 14, 2020",2018,PG-13,120,"Action-Adventure,Comedy,ScienceFiction",Ant-Man and the Wasp must join forces to uncover secrets from the past.,120,0
433,s434,TV Show,Nature Boom Time,,"Charlie Engelman, Kirby Engelman, Patrick Rahill",United States,"August 14, 2020",2016,TV-G,1,"Animals&Nature,Docuseries,Kids","Charlie, Kirby, and Patrick travel around the U.S. to learn about what makes nature awesome.",0,1
434,s435,TV Show,Sam's Zookeeper Challenge,,Sam Peltz,United States,"August 14, 2020",2018,TV-G,1,"Animals&Nature,Docuseries,Family",Sam is put to the test to care for animals in “Zookeeper’s Challenge.”,0,1
435,s436,TV Show,Scuba Sam's World,,Sam Peltz,United States,"August 14, 2020",2018,TV-G,1,"Animals&Nature,Docuseries,Kids",Take a deep dive and learn all about the beloved sea animals in our oceans!,0,1
436,s437,TV Show,Spaced Out,,Ben DeTour,,"August 14, 2020",2018,TV-G,1,"Docuseries,Kids",Learn about our universe through imagery taken from the Hubble Space Telescope.,0,1
437,s438,Movie,The Greatest Showman,Michael Gracey,"Hugh Jackman, Zac Efron, Michelle Williams, Rebecca Ferguson, Zendaya , Keala Settle",United States,"August 14, 2020",2017,PG,106,"Biographical,Drama,Family",A bold and original musical celebrating the birth of show business and dreams coming to life.,106,0
438,s439,TV Show,Weird But True!,,"Charlie Engelman, Kirby Engelman",United States,"August 14, 2020",2017,TV-G,3,"Animals&Nature,Kids,Variety","Come along as we reveal fun, strange & surprising facts about our world in Weird But True!",0,3
439,s440,TV Show,Wild Cats of India,,James Murray,United States,"August 14, 2020",2020,TV-PG,1,"Animals&Nature,Docuseries,Family",Journey across the country’s landscapes to paint an intimate portrait of India's Wild Cats.,0,1
440,s441,Movie,Howard,Don Hahn,Howard Ashman,United States,"August 7, 2020",2020,TV-PG,95,"Biographical,Documentary,Music","“Howard” is the untold story of Howard Ashman, the brilliant lyricist behind Disney classics.",95,0
441,s442,Movie,Prince of Persia: The Sands of Time,Mike Newell,"Jake Gyllenhaal, Ben Kingsley, Gemma Arterton, Alfred Molina, Richard Coyle, Toby Kebbell",United States,"August 7, 2020",2010,PG-13,117,"Action-Adventure,Fantasy",A rogue prince and rival princess safeguard a magical dagger with the power to reverse time.,117,0
442,s443,Movie,Star Wars: Galaxy's Edge-Adventure Awaits,,"Neil Harris, Kaley Cuoco, Oscar Isaac, Sarah Hyland, Keegan-Michael Key, Jay Leno",United States,"August 7, 2020",2019,TV-PG,81,"Documentary,Family",Celebrating Disney’s new land that brings Star Wars to life!,81,0
443,s444,Movie,The Hidden Kingdoms of China,"Ben Wallis, Emma Fraser, Jess Tombs",Michelle Yeoh,United States,"August 7, 2020",2020,TV-PG,88,"Animals&Nature,Documentary,Family",THE HIDDEN KINGDOMS OF CHINA takes audiences into the secret wilds of China.,88,0
444,s445,Movie,The Peanuts Movie,Steve Martino,"Noah Schnapp, Alex Garfin, Hadley Miller, Mariel Sheets, Venus Schultheis, Noah Johnston",United States,"August 7, 2020",2015,G,89,"Animation,Comedy,Family","Snoopy takes to the skies against The Red Baron, while his pal, Charlie Brown, begins an epic quest.",89,0
445,s446,TV Show,UFO Europe: The Untold Stories,,Robert Ashby,,"August 7, 2020",2012,TV-PG,1,"Docuseries,Reality",A selection of stories featuring encounters and sightings of the unexplained.,0,1
446,s447,TV Show,Animal Showdown,,Brian Peck,,"July 31, 2020",2018,TV-G,1,"Animals&Nature,Docuseries,Family",Animals face-off in this surprising competition of the toughest and biggest in the animal kingdom.,0,1
447,s448,TV Show,Best Job Ever,,,,"July 31, 2020",2018,TV-G,1,"Animals&Nature,Docuseries,Family",Check out the cool jobs Nat Geo explorers do every day!,0,1
448,s449,Movie,Big Cat Games,Jeremy Turner,Boone Smith,,"July 31, 2020",2015,TV-PG,44,"Animals&Nature,Family,Reality","Boone Smith hosts a feline showdown as lion, tiger and cheetah battle for top cat title.",44,0
449,s450,Movie,Black Is King,Beyoncé Knowles-Carter,Beyoncé Knowles-Carter,United States,"July 31, 2020",2020,TV-14,86,"Dance,Music,Musical","This visual album from Beyoncé reimagines lessons of ""The Lion King"" for young kings and queens.",86,0
450,s451,Movie,Cradle of the Gods,Tim Conrad,Tim Conrad,United Kingdom,"July 31, 2020",2012,TV-PG,45,"Documentary,Historical","Located on a hilltop sanctuary, G – bekli Tepe in Turkey is the world's first known temple.",45,0
451,s452,TV Show,Destination World,,Rick Robles,,"July 31, 2020",2018,TV-G,1,"Animals&Nature,Docuseries,Kids",Check out the continents and find out what makes them unique from each other!,0,1
452,s453,TV Show,Fearless Adventures with Jack Randall,,Jack Randall,,"July 31, 2020",2018,TV-PG,1,"Animals&Nature,Docuseries,Family",Check out Jack Randall go head-to-head with all kinds of critters.,0,1
453,s454,Movie,Hunt for the Abominable Snowman,Dan Oliver,Stephen Rashbrook,,"July 31, 2020",2011,TV-PG,45,Documentary,"Across the Himalayas are stories of the yeti, or abominable snowman.",45,0
454,s455,Movie,Incredibles 2,Brad Bird,"Craig Nelson, Holly Hunter, Sarah Vowell, Huckleberry Milner, Catherine Keener, Eli Fucile",United States,"July 31, 2020",2018,PG,118,"Action-Adventure,Animation,Family",The Incredibles spring into action when a dangerous new villain emerges.,118,0
455,s456,TV Show,King Fishers,,Stephen Mangan,United Kingdom,"July 31, 2020",2013,TV-PG,1,"Action-Adventure,Animals&Nature,Docuseries","With so many fishermen and so many fishing disciplines, who is best?",0,1
456,s457,Movie,Lost Temple of the Inca,Jim Aikman,Dan Nachtrab,United States,"July 31, 2020",2020,TV-PG,44,Documentary,A scientist discovers artifacts in Peru that could lead him to one of the country’s missing temples.,44,0
457,s458,TV Show,Marvel Funko Shorts,,,,"July 31, 2020",2016,TV-Y7,2,"Action-Adventure,Animation,Anthology",Marvel and Funko present Pop! style Marvel heroes.,0,2
458,s459,TV Show,Muppets Now,,"Dave Goelz, Matt Vogel, David Rudman, Peter Linz, Bill Barretta, Eric Jacobson",United States,"July 31, 2020",2020,TV-PG,1,"Comedy,Family,Lifestyle",The Muppets have a brand-new series ready to stream… but only if they can upload it in time.,0,1
459,s460,Movie,Surviving the Mount St. Helens Disaster,Sophie Harris,Bill Ratner,United Kingdom,"July 31, 2020",2020,TV-PG,44,"Animals&Nature,Documentary",Eyewitness accounts and rare images chart the violent 1980 eruption of Mount St. Helens.,44,0
460,s461,TV Show,What Sam Sees,,Sam Peltz,,"July 31, 2020",2018,TV-G,1,"Animals&Nature,Docuseries,Family","Join Sam on an underwater journey and learn about sharks, eels, and more!",0,1
461,s462,Movie,Pirates of the Caribbean: Dead Men Tell No Tales,"Joachim Rønning, Espen Sandberg","Johnny Depp, Javier Bardem, Brenton Thwaites, Kaya Scodelario, Kevin McNally, Golshifteh Farahani",United States,"July 24, 2020",2017,PG-13,129,"Action-Adventure,Fantasy",Captain Jack Sparrow searches for the Trident of Poseidon.,129,0
462,s463,TV Show,PJ Masks (Shorts),,,,"July 24, 2020",2017,TV-Y,1,"Action-Adventure,Animation,Kids",The PJ Masks are protecting the city from villains!,0,1
463,s464,TV Show,Rogue Trip,,"Bob Woodruff, Mack Woodruff",,"July 24, 2020",2020,TV-PG,1,"Buddy,Docuseries",Bob Woodruff and his son travel the world searching for beauty and adventure in unexpected places.,0,1
464,s465,TV Show,Wild Congo,,Corey Johnson,,"July 24, 2020",2014,TV-PG,1,"Animals&Nature,Docuseries,Family",The Congo: the most mysterious river in the dark heart of Africa.,0,1
465,s466,TV Show,Wild Sri Lanka,,Paul McGann,United Kingdom,"July 24, 2020",2016,TV-PG,1,"Animals&Nature,Docuseries",This three-part series reveals the spectacular nature and amazing wildlife of Sri Lanka.,0,1
466,s467,Movie,A Pre-Opening Report from Disneyland,Wilfred Jackson,"Walt Disney, Winston Hibler",United States,"July 17, 2020",1955,TV-PG,55,"Documentary,Family,Historical",Walt provides a look at the details needed to get the Park ready to open. See details for advisory.,55,0
467,s468,Movie,Diary of a Wimpy Kid: The Long Haul,David Bowers,"Jason Drucker, Alicia Silverstone, Tom Scott, Charlie Wright, Owen Asztalos, Dylan Walters",United States,"July 17, 2020",2017,PG,92,"Comedy,Family",A trip to Meemaw’s 90th birthday takes a detour due to Greg’s scheme to attend a gaming convention!,92,0
468,s469,TV Show,Disney Junior Music Lullabies,,,,"July 17, 2020",2018,TV-Y,1,"Animation,Kids,Music",Disney Junior songs reimagined as calming lullabies.,0,1
469,s470,Movie,Lost City of Machu Picchu,,Craig Sechler,United States,"July 17, 2020",2019,TV-14,44,"Documentary,Family",Who were the mysterious people who built Machu Picchu and why?,44,0
470,s471,TV Show,Super Robot Monkey Team Hyperforce Go!,,"Greg Cipes, Kevin Michael	Richardson, Tom Kenny, Kari Wahlgren, Clancy Brown, Corey Feldman","United States, Japan","July 17, 2020",2004,TV-Y7,2,"Action-Adventure,Animation,Anime",Chiro and a team of five Robot Monkeys defend Shuggazoom City against Skeleton King and his minions.,0,2
471,s472,Movie,The Mouseketeers at Walt Disney World,John Tracy,"Jo Worley, Ronnie Schell, Dennis Underwood, Leslie Norris, Billy Attmore, Scott Craig",United States,"July 17, 2020",1977,TV-PG,56,"ComingofAge,Drama,Family",The Mouseketeers arrive to perform at Walt Disney World. See details for advisory.,56,0
472,s473,TV Show,Wild Chile,,Peter Venn,United Kingdom,"July 17, 2020",2017,TV-PG,1,"Animals&Nature,Docuseries,Family",This beautiful and intriguing blue-chip series explores the incredibly varied wildlife of Chile.,0,1
473,s474,Movie,X-Men: Apocalypse,Bryan Singer,"James McAvoy, Michael Fassbender, Jennifer Lawrence, Oscar Isaac, Nicholas Hoult, Rose Byrne",United States,"July 17, 2020",2016,PG-13,144,"Action-Adventure,Family,ScienceFiction","Apocalypse, the most powerful mutant in the universe, tries to destroy all of mankind.",144,0
474,s475,TV Show,Cosmos: A Spacetime Odyssey,,"Neil Tyson, Stoney Emshwiller",United States,"July 10, 2020",2013,TV-PG,1,"Action-Adventure,Docuseries,Family",A 13-part adventure across the universe of space and time.,0,1
475,s476,Movie,Hamilton: History Has Its Eyes on You,,"Lin-Manuel Miranda, Thomas Kail, Christopher Jackson, Leslie Odom Jr., Phillipa Soo, Renee Goldsberry",United States,"July 10, 2020",2020,TV-PG,47,"Historical,Musical","Robin Roberts hosts a discussion with Lin-Manuel Miranda, Thomas Kail, and original cast members.",47,0
476,s477,Movie,Solo: A Star Wars Story,Ron Howard,"Alden Ehrenreich, Woody Harrelson, Emilia Clarke, Donald Glover, Thandie Newton, Phoebe Waller-Bridge",United States,"July 10, 2020",2018,PG-13,135,"Action-Adventure,Crime,ScienceFiction",Witness the beginning of the Star Wars saga's most unlikely hero.,135,0
477,s478,Movie,X-Men: Days of Future Past,Bryan Singer,"Hugh Jackman, James McAvoy, Michael Fassbender, Jennifer Lawrence, Halle Berry, Nicholas Hoult","United States, United Kingdom, Canada","July 10, 2020",2014,PG-13,132,"Action-Adventure,Family,ScienceFiction",Characters from the X-Men trilogy join their younger selves to change the past and save our future.,132,0
478,s479,Movie,The Undefeated Presents: Hamilton In-Depth,,"Lin-Manuel Miranda, Thomas Kail, Renee Goldsberry, Leslie Odom Jr., Daveed Diggs, Phillipa Soo",United States,"July 5, 2020",2020,TV-PG,33,"Historical,Musical",The Undefeated Presents: Hamilton In-Depth is a roundtable discussion with 9 stars and the director.,33,0
479,s480,TV Show,Animal ER,,Dr. Brian Beale,United States,"July 3, 2020",2016,TV-PG,2,"Animals&Nature,Docuseries,Family",Animal ER brings you up close to the bleeding edge of animal care.,0,2
480,s481,Movie,Diary of a Wimpy Kid: Rodrick Rules,David Bowers,"Zachary Gordon, Devon Bostick, Rachael Harris, Robert Capron, Steve Zahn",United States,"July 3, 2020",2011,PG,100,"Comedy,Family","In 7th grade, Greg must bond with his brother, Rodrick while also impressing the new girl in town.",100,0
481,s482,Movie,Hamilton,Thomas Kail,"Daveed Diggs, Renée Goldsberry, Jonathan Groff, Christopher Jackson, Jasmine Jones, Lin-Manuel Miranda",United States,"July 3, 2020",2020,PG-13,160,"Biographical,Historical,Musical",The filmed version of Broadway original “Hamilton” that soars in music and tale.,160,0
482,s483,Movie,Ice Age: Collision Course,Mike Thurmeier,"Ray Romano, John Leguizamo, Denis Leary, Adam Devine, Jesse Ferguson, Max Greenfield","United States, United Kingdom, Australia","July 3, 2020",2016,PG,97,"Action-Adventure,Animation,Comedy","When their world is threatened, Manny and friends go on a quest to survive the Scrat-tastrophe!",97,0
483,s484,Movie,Race to Witch Mountain,Andy Fickman,"Dwayne Johnson, AnnaSophia Robb, Carla Gugino, Ciarán Hinds, Alexander Ludwig, Tom Scott",United States,"July 3, 2020",2009,PG,100,"Action-Adventure,Family,ScienceFiction",A Las Vegas cab driver helps two aliens disguised as teens get home to save their planet... and ours.,100,0
484,s485,Movie,The Big Green,Holly Sloan,"Steve Guttenberg, Olivia d'Abo, Jay Sanders, John Terry, Chauncey Leopardi, Patrick Renna",United States,"July 3, 2020",1995,PG,100,"Comedy,Family,Sports",A group of bored misfits become local soccer heroes in a sleepy Texas town.,100,0
485,s486,Movie,The Mighty Ducks,Stephen Herek,"Emilio Estevez, Joss Ackland, Lane Smith, Heidi Kling, Josef Sommer, Joshua Jackson",United States,"July 3, 2020",1992,PG,104,"Comedy,Drama,Sports",A hotshot lawyer reluctantly coaches a hapless pee wee hockey team.,104,0
486,s487,Movie,While You Were Sleeping,Jon Turteltaub,"Sandra Bullock, Bill Pullman, Peter Gallagher, Peter Boyle, Glynis Johns, Micole Mercurio",United States,"July 3, 2020",1995,PG,104,"Comedy,Drama,Romance",A lonely subway worker is mistaken for a comatose man's finacée.,104,0
487,s488,TV Show,Disney A.N.T. Farm,,"China McClain, Sierra McCormick, Jake Short, Stefanie Scott, Carlon Jeffery",United States,"June 26, 2020",2011,TV-G,3,"Comedy,ComingofAge,Music",Chyna Sparks and her friends are the newest members of the A.N.T. program.,0,3
488,s489,TV Show,Into the Unknown: Making Frozen 2,,"Kristen Bell, Idina Menzel, Josh Gad, Jonathan Groff, Jennifer Lee, Chris Buck",United States,"June 26, 2020",2020,TV-PG,1,"Docuseries,Family","For the first time, go behind-the-scenes into the making of the #1 animated film, Frozen 2.",0,1
489,s490,Movie,Man in Space,Ward Kimball,"Walt Disney, Dick Tufeld, Ward Kimball, Willy Ley, Dr. Heinz Haber, Dr. Wernher von Braun",United States,"June 26, 2020",1955,TV-PG,49,"Documentary,Family","From the TV series Disneyland, a look at the history of space travel. See details for advisory.",49,0
490,s491,Movie,Mars and Beyond,Ward Kimball,"Walt Disney, Paul Frees, Dr. Ernst Stuhlinger, Dr. Wernher von Braun, Dr. E.C. Slipher",United States,"June 26, 2020",1957,TV-G,53,"Animation,Documentary,Family",An animated look at humankind's early views of the universe and life on Mars.,53,0
491,s492,Movie,Marvel Studios' Avengers: Infinity War,"Anthony Russo, Joe Russo","Robert Downey Jr., Chris Hemsworth, Mark Ruffalo, Chris Evans, Scarlett Johansson, Don Cheadle",United States,"June 26, 2020",2018,PG-13,152,"Action-Adventure,Fantasy,ScienceFiction",The Avengers must be willing to sacrifice all to defeat Thanos.,152,0
492,s493,Movie,Tarzan,"Kevin Lima, Chris Buck","Tony Goldwyn, Minnie Driver, Glenn Close, Alex Linz, Rosie O'Donnell, Brian Blessed",United States,"June 26, 2020",1999,G,93,"Action-Adventure,Animation,ComingofAge","Adopted by gorillas, Tarzan’s life changes forever when he meets other humans.",93,0
493,s494,Movie,Tarzan II,Brian Smith,"Harrison Chad, George Carlin, Brad Garrett, Ron Perlman, Estelle Harris, Glenn Close",United States,"June 26, 2020",2005,G,75,"Action-Adventure,Animation,ComingofAge",Young Tarzan decides his ape family would be better off without him.,75,0
494,s495,TV Show,101 Dalmatians (Series),,"Jeff Bennett, Christine Cavanaugh, Tara Charendoff, Jim Cummings, Tress MacNeille, Charlotte Rae",,"June 19, 2020",1997,TV-Y7,1,"Action-Adventure,Animation,Kids",The Dearly Family move to a new farm home in the country.,0,1
495,s496,Movie,Big Sur: Wild California,,Hector Elizondo,United States,"June 19, 2020",2010,TV-PG,47,"Animals&Nature,Documentary,Family",Why is California's Big Sur coastline experiencing an explosion in wildlife?,47,0
496,s497,TV Show,Disney Junior Muppet Babies Play Date,,,,"June 19, 2020",2018,TV-Y,1,"Comedy,Kids",Time for a playdate with the Muppet Babies!,0,1
497,s498,Movie,Egypt's Treasure Guardians,"Ben Allen, Tom Jenner",Dominic Frisby,United Kingdom,"June 19, 2020",2016,TV-PG,44,"Documentary,Historical","This programme follows a select cast of individuals, determined to bring Egypt back from the brink.",44,0
498,s499,Movie,The Jungle Book,Jon Favreau,"Bill Murray, Ben Kingsley, Idris Elba, Lupita Nyong'o, Scarlett Johansson, Giancarlo Esposito","United Kingdom, United States","June 19, 2020",2016,PG,108,"Action-Adventure,ComingofAge,Family",A man-cub who’s been raised by a family of wolves eludes a dangerous tiger.,108,0
499,s500,Movie,The Pirate Fairy,Peggy Holmes,"Mae Whitman, Christina Hendricks, Tom Hiddleston, Lucy Liu, Raven-Symoné , Megan Hilty",United States,"June 19, 2020",2014,G,78,"Action-Adventure,Animation,Family",Tinker Bell and friends face the pirates of Skull Rock to save a friend.,78,0
500,s501,Movie,Trail Mix-Up,Barry Cook,"Charles Fleischer, Kathleen Turner, April Winchell, Lou Hirsch, Corey Burton, Frank Welker",United States,"June 19, 2020",1993,TV-G,9,"Action-Adventure,Animation,Comedy",Roger Rabbit is left to care for Baby Herman in Yellowstone National Park.,0,9
